"id","text","screenName","created","favoriteCount","retweetCount"
"1462147226763997191","@pkristoefel Danke <U+0001F60E>","WKogler",2021-11-20 19:53:58,3,0
"1462146825016729605","@DieRaffa Danke","WKogler",2021-11-20 19:52:23,19,0
"1462066953888178180","@GrueneSt Danke Euch <U+0001F49A><U+0001F33B>","WKogler",2021-11-20 14:35:00,4,0
"1461709205728071680","(7/7) Jetzt geht es darum zusammenzuhalten und gemeinsam die vierte Welle zu brechen. Und es geht auch darum, das V… https://t.co/cLMuVj0YSl","WKogler",2021-11-19 14:53:26,61,2
"1461709201894424582","(6/7) Ich bedanke mich bei Gesundheitsminister @WolfgangMueckst, bei Bundeskanzler @a_schallenberg und den Landesha… https://t.co/E2bu1jrb12","WKogler",2021-11-19 14:53:25,46,1
"1461709197234610182","(5/7) Deshalb hat sich die Bundesregierung mit den Landeshauptleuten auf eine umfassende und seriöse Vorbereitung d… https://t.co/TuAsRgGj2u","WKogler",2021-11-19 14:53:24,33,3
"1461709193333952531","(4/7) die jetzt so wichtige Auffrischungsimpfung voranzutreiben. Ebenso wichtig ist es, möglichst viele Menschen zu… https://t.co/8DdsLZMCR8","WKogler",2021-11-19 14:53:23,38,3
"1461709188854333444","(3/7) In dieser Situation war und ist es extrem wichtig, wieder geschlossen und konsequent vorzugehen. Es ist allen… https://t.co/W6Uz9aA0FD","WKogler",2021-11-19 14:53:22,38,1
"1461709184043569159","(2/7) Die Infektionszahlen steigen dramatisch an. Vielerorts sind die Spitäler, die Intensivstationen und vor allem… https://t.co/4VmltlkFW3","WKogler",2021-11-19 14:53:21,37,1
"1461709177731137544","Ich bin derzeit als Kontaktperson 1 im Homeoffice und bis einschließlich Sonntag in Quarantäne. Ich war aber mit Ge… https://t.co/5xp1buniRo","WKogler",2021-11-19 14:53:19,97,9
"1460675653624291339","Danke für die vielen Nachrichten. Mein erster PCR-Test ist zum Glück negativ, als Vorsichtsmaßnahme werde ich mich… https://t.co/CfyMh7RgCH","WKogler",2021-11-16 18:26:28,464,7
"1460578257745715208","(2/2) Ich wünsche meinem Mitarbeiter und allen anderen derzeit an Covid Erkrankten gute Besserung. (wk)","WKogler",2021-11-16 11:59:27,203,3
"1460578253085814786","Ich habe mich wegen eines positiven Corona-Tests eines Mitarbeiters, der bisher keine Symptome zeigt, soeben abgeso… https://t.co/vH7LW5sfHh","WKogler",2021-11-16 11:59:26,414,27
"1460285289809727488","(6/6) Ab Mittwoch werden wir sehen, inwiefern sich die 2G-Regel auf das Infektionsgeschehen ausgewirkt hat. Auf Bas… https://t.co/vXtrL33Yjv","WKogler",2021-11-15 16:35:18,233,14
"1460285280217411591","(5/6) Auf das zu hören, was die Wissenschaft sagt und ja – auch unpopuläre Maßnahmen vorzubereiten und auf den Tisc… https://t.co/1r8azbmk3k","WKogler",2021-11-15 16:35:16,281,16
"1460285274794168320","(4/6) Deshalb gilt es jetzt, die nächsten Schritte vorzubereiten. Als Gesundheitsminister ist genau das Wolfgang Mü… https://t.co/MSsaO74XD1","WKogler",2021-11-15 16:35:14,195,9
"1460285269710618627","(3/6) Der Lockdown für Ungeimpfte, den wir gemeinsam als Bundesregierung mit den Ländern beschlossen haben, ist ein… https://t.co/hFMKNG6Dnf","WKogler",2021-11-15 16:35:13,153,11
"1460285264287477765","(2/6) Vor diesem Hintergrund hat der Gesundheitsminister nach umfangreichen Beratungen gestern Maßnahmen vorgelegt,… https://t.co/0CyWbaaPQQ","WKogler",2021-11-15 16:35:12,148,8
"1460285248810409984","Die Lage ist dramatisch. Wir sind inmitten der vierten Welle, die Infektionszahlen steigen, immer mehr Menschen lei… https://t.co/zRyKsz3zp2","WKogler",2021-11-15 16:35:08,376,67
"1458837203967254539","(3/3) und den IHRA Österreich Ko-Vorsitzenden @LessingHannah und Ferdinand Trauttmansdorff statt.","WKogler",2021-11-11 16:41:07,12,1
"1458837201803005952","(2/3) Die feierliche Unterzeichnung fand im Beisein von Europa- und Verfassungsministerin @k_edtstadler, Israels Di… https://t.co/24kEVZHuPe","WKogler",2021-11-11 16:41:07,16,1
"1458837197583441927","Entschlossen gegen jeden Antisemitismus anzukämpfen heißt auch, alle Bereiche des Lebens einzubeziehen. Gerade der… https://t.co/Fwy2mQ4pRR","WKogler",2021-11-11 16:41:06,45,14
"1458358495523266567","Was für eine traurige Nachricht. In meiner Zeit im Parlament habe ich Otto Pendl als engagierten Kollegen kennen- u… https://t.co/Z2fUgQ3OVT","WKogler",2021-11-10 08:58:54,66,3
"1458153757452251137","Heute wurde die Shoah-Gedenkmauer ihrer Bestimmung übergeben. 64.440 Namen stehen auf 160 Steinelementen mitten in… https://t.co/2yD4NDmTwe","WKogler",2021-11-09 19:25:21,95,3
"1458127526551859201","(3/3) Insbesondere von jenen Staaten und Akteuren, die auf der Bremse stehen.","WKogler",2021-11-09 17:41:07,12,0
"1458127524920283138","(2/3) dem Klimaticket und auch dem massiven Ausbau der Öffis. Klar ist auch: niemand darf sich aus der Verantwortun… https://t.co/SpQmU7G5pd","WKogler",2021-11-09 17:41:07,14,0
"1458127521027923977","Wer sich klimafreundlich verhält, darf nicht der Dumme sein! Daher setzen wir stark auf Investitionen in klimafreun… https://t.co/wI7XJ8lW8j","WKogler",2021-11-09 17:41:06,32,2
"1458095835493851139","(2/2) Im Zentrum unseres Gesprächs standen die Bemühungen der Bundesregierung für humanitäre Hilfe sowie die Unters… https://t.co/R8m4geXe2i","WKogler",2021-11-09 15:35:11,11,1
"1458095828258676738","Stv. UNHCR-Flüchtlingshochkommissarin @GillianTriggs und @UNHCR_Pinter engagieren sich seit Jahren für Menschenrech… https://t.co/OkxFS2Ce0v","WKogler",2021-11-09 15:35:10,20,2
"1458002402976600067","Der brutal gelenkte Angriff auf jüdisches Leben am 9. November 1938 erfolgte aus der Mitte der Gesellschaft. Auch d… https://t.co/WcJmcaRPVp","WKogler",2021-11-09 09:23:55,77,10
"1457318788467240966","Oberstes Ziel der Corona-Maßnahmen ist immer, die Überlastung des Gesundheitssystems zu verhindern. Dabei geht es n… https://t.co/2fB3Ix2cV7","WKogler",2021-11-07 12:07:29,77,7
"1455431368079552518","(3/3) Und an die Wiener:innen, die sich nicht unterkriegen haben lassen, füreinander da waren und in einer Notsitua… https://t.co/0pcXDgxPTg","WKogler",2021-11-02 07:07:33,29,0
"1455431366431158273","(2/3) und in Angst und Schrecken versetzt wurden. Unser Mitgefühl ist bei den Angehörigen und Hinterbliebenen der O… https://t.co/kQgeFVOnVn","WKogler",2021-11-02 07:07:33,27,0
"1455431363893633027","Heute gedenken wir der Opfer des grausamen Terroranschlags vom 2. November 2020. Wir erinnern an die vier Todesopfe… https://t.co/PGrZMvJoik","WKogler",2021-11-02 07:07:32,97,7
"1453714862631100423","(3/3) Ich danke Norbert Schnedl und Christian Meidlinger für das erste konstruktive Gespräch und bin zuversichtlich… https://t.co/AV7HKsbXWs","WKogler",2021-10-28 13:26:46,17,1
"1453714857258225673","(2/3) verglichen mit der Privatwirtschaft besonders krisensicher. Heute habe ich die Vorsitzenden der Gewerkschafte… https://t.co/82hCc03b3l","WKogler",2021-10-28 13:26:45,11,1
"1453714848584404993","Der öffentliche Dienst hat auch im vergangenen Jahr Durchhaltevermögen und hohe Kompetenz bewiesen. Ohne das Engage… https://t.co/OUb0HSSrcj","WKogler",2021-10-28 13:26:43,33,4
"1453000873848750087","Ein Ticket für ganz Österreich. Seit heute ist das #Klimaticket Realität! https://t.co/YOqwkO6pzw","WKogler",2021-10-26 14:09:38,229,28
"1452920069701488650","(3/3) So erfolgt die Ausrufung einer Krise nur mit Zustimmung des Nationalrats. Dadurch ist Österreich auch in Zuku… https://t.co/nq5ORgQKHP","WKogler",2021-10-26 08:48:33,10,4
"1452920068078194689","(2/3) Bei der Krisenbewältigung wird gesetzlich sichergestellt, dass alle relevanten Partner:innen wie Bundesländer… https://t.co/snnLpnBX3Y","WKogler",2021-10-26 08:48:32,12,4
"1452920065855262724","Am heutigen #Nationalfeiertag haben wir im Ministerrat das Krisensicherungsgesetz auf den Weg gebracht. Damit Öster… https://t.co/xNhpl1i0A4","WKogler",2021-10-26 08:48:32,32,6
"1451504826517540867","Erhellender wirtschaftspolitischer Austausch mit @atanaspekanov – Mitglied der bulgarischen Übergangsregierung - zu… https://t.co/bfgvwo0IgA","WKogler",2021-10-22 11:04:52,34,4
"1451192799601180683","Madame President @sandumaiamd, it was my pleasure to welcome you today. Thank you for the significant insights abou… https://t.co/R11WOyDXn5","WKogler",2021-10-21 14:24:59,38,1
"1451133072917794820","(2/2) Ich gratuliere @KRogenhofer, @AnnaKiesenhofer, @niki_popper und vielen weiteren ganz herzlich zu dieser verdienten Auszeichnung. (wk)","WKogler",2021-10-21 10:27:39,19,1
"1451133064814465028","#Austria21 Die Preisträger:innen des gestrigen Abends schauen nach vorne und wollen unser Land weiterbringen. Noch… https://t.co/c4XJWfQsJw","WKogler",2021-10-21 10:27:38,44,4
"1450863398514741248","Ich bin heute bei @corinnamilborn auf #puls24 zu Gast. https://t.co/L1bc2AjT7O","WKogler",2021-10-20 16:36:04,34,5
"1450428896395079687","Im Sinne der Stabilität und Verantwortung ist mir der regelmäßige Austausch mit den Landeshauptleuten ein besondere… https://t.co/7ajYJk2b9M","WKogler",2021-10-19 11:49:31,61,4
"1449699633375109125","Ein großes Danke an Ehrenpräsident Leo Windtner für die wertschätzende und vertrauensvolle Zusammenarbeit der letzt… https://t.co/TevzESTJvO","WKogler",2021-10-17 11:31:41,20,2
"1449355210497855488","Wien braucht starke Grüne! Herzliche Gratulation an das Zukunftsduo @j_puehringer und @peterkraus <U+0001F64C> https://t.co/vfSIgd4WGP","WKogler",2021-10-16 12:43:04,78,3
"1449354463270129667","@gruenewien @j_puehringer @peterkraus Herzliche Gratulation! <U+0001F49A>","WKogler",2021-10-16 12:40:06,4,0
"1449268875984506882","<U+0001F399> Radiotipp: heute um 12:00 Uhr bin ich bei @oe1journale im „Journal zu Gast“. https://t.co/OHkHUoyEYQ","WKogler",2021-10-16 07:00:00,92,10
"1449021675064922120","(2/2) in den verschiedensten Kategorien zur Wahl zu Österreichs Sportler:innen des Jahres 2021 – und Hermann Maier… https://t.co/miDWZJ2yxy","WKogler",2021-10-15 14:37:43,11,1
"1449021669864087556","Danke an die @SporthilfeAT für eine stimmungsvolle Gala voller Gänsehautmomente im Wiener Konzerthaus. Ich gratulie… https://t.co/IBhgZvbLVI","WKogler",2021-10-15 14:37:42,36,4
"1448896446703493120","Zu Besuch bei der ""Klimasprechstunde"" am Wiener Heldenplatz. Danke an das Klimavolksbegehren @klima_vb für die Einl… https://t.co/immW0ithgz","WKogler",2021-10-15 06:20:06,82,9
"1448663615616159745","Gute Neuigkeiten: Österreich bekommt ein Einwegpfand und mehr Mehrweg-Verpackungen! https://t.co/rksUOs1Za0","WKogler",2021-10-14 14:54:55,258,15
"1448321610700804099","(2/2) fördern mehr Diversität im Sport und erhöhen das Kulturbudget auf den historischen Höchststand.","WKogler",2021-10-13 16:15:55,28,2
"1448321607731187718","Ob Jung oder Alt: das Budget für 2022 betrifft uns alle. Deshalb investieren wir in den Ausbau der Ganztagsschulen… https://t.co/ukGD4UVQ2p","WKogler",2021-10-13 16:15:54,65,6
"1448307539167170567","Das neue Budget für 2022 gewährleistet die Stärkung und Absicherung der unabhängigen Justiz. Darüber hinaus erhöhen… https://t.co/haIw1e8DEc","WKogler",2021-10-13 15:20:00,56,10
"1448293739911393289","(2/2) Außerdem ermöglichen wir mit dem Budget das Klimaticket, moderne Öffis und saubere Energie. So geht ökologisc… https://t.co/x1LrlQfqrr","WKogler",2021-10-13 14:25:10,30,2
"1448293736937558016","Heute haben wir das Budget für 2022 präsentiert. Mit der ökosozialen Steuerreform bekommt klimaschädliches Verhalte… https://t.co/KN2MWViKzj","WKogler",2021-10-13 14:25:09,61,8
"1447958876209434628","Verantwortung für Österreich übernehmen heißt auch, bereits geplante Projekte gemeinsam umzusetzen. Zum Beispiel be… https://t.co/wXzL4DKeTT","WKogler",2021-10-12 16:14:32,138,19
"1447521502165934081","Start in eine neue Woche mit der Angelobung von Bundeskanzler Alexander #Schallenberg und Außenminister Michael… https://t.co/v04va7dxzv","WKogler",2021-10-11 11:16:34,152,8
"1447252977417441288","(2/2) Es gibt noch viel zu tun:
<U+2705> Die ökosoziale Steuerreform,
<U+2705> der Ausbau der Kindergartenplätze,
<U+2705> der Pflege-Au… https://t.co/Hqb0eJt2gY","WKogler",2021-10-10 17:29:33,149,10
"1447252973189488642","Die vergangenen Tage haben gezeigt: wenn wir das Gemeinsame vor das Trennende stellen, kommt Österreich voran. Mein… https://t.co/xUvauwPox6","WKogler",2021-10-10 17:29:32,255,30
"1446925183470686212","In der aktuellen Situation geht es mir darum, Stabilität für Österreich zu garantieren. https://t.co/Q7CfKpVFGa","WKogler",2021-10-09 19:47:00,418,46
"1446547102851600411","Mein heutiges Statement in der #ZIB1. https://t.co/dQU01L3WEX","WKogler",2021-10-08 18:44:39,1485,166
"1446537590623047683","Heute haben wir Gespräche mit allen Parlamentsparteien geführt. Das klare Ziel: in dieser schwierigen Zeit Stabilit… https://t.co/Dvvw9scEkc","WKogler",2021-10-08 18:06:51,693,59
"1446095247549812745","(3/3) Ich werde diesen Gesprächen nicht vorgreifen - in so einer Situation braucht es Augenhöhe, Respekt und Vertrauen. (wk)","WKogler",2021-10-07 12:49:08,246,6
"1446095245977047044","(2/3) Deshalb suche ich das Gespräch mit dem Bundespräsidenten und allen Parlamentsparteien. Wir haben eine gemeins… https://t.co/0JPabjYijL","WKogler",2021-10-07 12:49:08,244,6
"1446095243150086148","Nach dem gestrigen Tag können wir nicht einfach zur Tagesordnung übergehen. Die erhobenen Vorwürfe wiegen schwer: e… https://t.co/904H1u43vW","WKogler",2021-10-07 12:49:07,574,47
"1446028352557621249","(5/5) Wir müssen gemeinsam für Stabilität und Aufklärung sorgen und darum möchte ich parteiübergreifend das weitere… https://t.co/WOKYBMlR9L","WKogler",2021-10-07 08:23:19,1009,44
"1446028350657638402","(4/5) Darum werden Vizekanzler Kogler und Klubobfrau @sigi_maurer die Klubobleute aller Parlamentsparteien zu Gespr… https://t.co/XDtb4L6C67","WKogler",2021-10-07 08:23:19,831,43
"1446028349101465601","(3/5) Wir können nicht zur Tagesordnung übergehen, die Handlungsfähigkeit des Bundeskanzlers ist vor diesem Hinterg… https://t.co/DYxh5MoXvr","WKogler",2021-10-07 08:23:18,811,55
"1446028347595796483","(2/5) „Damit ist eine neue Dimension erreicht. Der Eindruck ist verheerend, der Sachverhalt muss lückenlos aufgeklä… https://t.co/M6gXSkBVHG","WKogler",2021-10-07 08:23:18,746,33
"1446028346274590724","Gestern wurde eine Anordnung zu Hausdurchsuchungen in der ÖVP-Parteizentrale, dem Finanzministerium und dem Bundesk… https://t.co/h5qoKAIFNX","WKogler",2021-10-07 08:23:18,2027,274
"1445385797805428747","(2/2) Österreich hat die immerwährende Verantwortung, die Erinnerung an die Shoah wach zu halten, der Opfer zu gede… https://t.co/xtb1azPzJy","WKogler",2021-10-05 13:50:02,32,2
"1445385793774759942","Gestern fand die Generalversammlung der Österreichischen Freunde von Yad Vashem statt. Dabei hatte ich die Gelegenh… https://t.co/33CNFsjvW7","WKogler",2021-10-05 13:50:01,79,15
"1444682736934047745","(2/2) Das ist ein Versprechen. Und dieses Versprechen geben wir heute unseren Kindern und deren Kindern. Mit dieser… https://t.co/20eL3xgzDY","WKogler",2021-10-03 15:16:20,35,2
"1444682734325088268","Unser Steuersystem gibt ab jetzt auf unser Klima Acht. Alles, was das Klima schützt und unsere Zukunft sichert, wir… https://t.co/XRPKWN5SCh","WKogler",2021-10-03 15:16:19,82,16
"1438442506090332168","(2/2) Die Klimakrise sieht er als größte Herausforderung. Laut World Disasters Report waren 77 % der globalen Katas… https://t.co/rJC01ePUNH","WKogler",2021-09-16 09:59:53,11,2
"1438442503053713410","Das Rote Kreuz ist das Rückgrat für humanitäre Soforthilfe: bei Kriegen, Naturkatastrophen oder der Pandemiebekämpf… https://t.co/3gJfjw2fPN","WKogler",2021-09-16 09:59:52,34,7
"1438182706383294466","Ich wünsche allen Jüdinnen und Juden ein friedliches #JomKippur. Gmar Chatima Tova! (wk)","WKogler",2021-09-15 16:47:32,79,2
"1438092253592002560","Dieses Engagement braucht es heute mehr denn je. Zum runden Geburtstag alles Gute! (wk) #gp50th #hopeinaction","WKogler",2021-09-15 10:48:06,11,1
"1438092248139374597","Ein halbes Jahrhundert @Greenpeace - das sind 50 Jahre unermüdlicher Einsatz für Umwelt und Frieden. Schon 1971 hab… https://t.co/XhhYQnrVI9","WKogler",2021-09-15 10:48:05,32,4
"1437456582799933446","(2/2) Unter anderem haben wir über das Projekt #Sportpass gesprochen, das armutsbetroffenen Kindern und Jugendliche… https://t.co/pNIaAnbqmu","WKogler",2021-09-13 16:42:10,11,3
"1437456580233109507","Danke an @erichfenninger für den spannenden Austausch, insbesondere über notwendige Maßnahmen zur Bekämpfung von… https://t.co/U0XfwBQMx7","WKogler",2021-09-13 16:42:10,25,1
"1436573973576310785","Viele von uns haben im vergangenen Jahr die Sehnsucht nach einem „Way Out“ erlebt. Mit diesem Thema beschäftigt sic… https://t.co/VuffQOkkFz","WKogler",2021-09-11 06:15:00,17,4
"1436063229671886852","(2/2) Ein kritischer Intellektueller, der seine Visionen in der Realität auch gegen Widerstände umsetzen wollte. Un… https://t.co/NOwQm2pGch","WKogler",2021-09-09 20:25:29,62,3
"1436063227927048198","Caspar Einem war ein durch und durch politischer Mensch, der einen langen Weg zurückgelegt hat: von der außerparlam… https://t.co/e2EZe8X3Gt","WKogler",2021-09-09 20:25:28,94,2
"1435629729814618113","(2/2) unter anderem über Österreichs internationales Engagement für den Klimaschutz austauschen. Denn: Ohne aktive… https://t.co/RTKz5lMkqI","WKogler",2021-09-08 15:42:54,16,1
"1435629724735315976","Nur gemeinsam können wir die großen Herausforderungen unserer Zeit meistern! Heute konnte ich mich bei der jährlich… https://t.co/W0oK5wT1aX","WKogler",2021-09-08 15:42:53,20,3
"1435279745290276867","Mehr als 200 Unternehmen setzen sich für einen österreichischen #GreenDeal ein. Heute hab ich mich mit den Unterzei… https://t.co/IfMOpueQ9M","WKogler",2021-09-07 16:32:12,34,8
"1435240651977859081","(2/2) zeigt, dass viele heimische Unternehmen im ambitionierten Klimaschutz eine Chance sehen. Ich danke für den gu… https://t.co/Jzwxms8ueJ","WKogler",2021-09-07 13:56:51,23,3
"1435240649159319554","245 Unternehmen haben sich mit ihrem „Appell der Wirtschaft“ an die Bundesregierung gewandt und einen österreichisc… https://t.co/IA4n5jJ2rC","WKogler",2021-09-07 13:56:50,64,15
"1434937763934183430","(2/2) Auch wir im Sportministerium werden die Weichen stellen, damit in Paris ähnliche Erfolge möglich sein werden.… https://t.co/pxmoxdkP8X","WKogler",2021-09-06 17:53:17,11,1
"1434937760348086275","Große Hochachtung für die Leistung der Athlet:innen des @npc_austria!1 #Gold-, 5 #Silber-, 3 #Bronze-Medaillen - da… https://t.co/VI8z7YymDP","WKogler",2021-09-06 17:53:16,36,2
"1434874049235140609","(2/2) Danke lieber @katzianw für das heutige Arbeitsgespräch!","WKogler",2021-09-06 13:40:06,18,0
"1434874045825224716","Zahlreiche Vorhaben der Bundesregierung werden gemeinsam mit starken Sozialpartnern wie dem @oegb_at diskutiert &amp; a… https://t.co/Micy83xfAd","WKogler",2021-09-06 13:40:05,26,2
"1434827549633388545","Ich wünsche allen Jüdinnen und Juden ein friedliches, gesundes und glückliches neues Jahr! https://t.co/UCIpqQVX5F","WKogler",2021-09-06 10:35:20,31,1
"1433381449655279616","(2/2) Ein wichtiger Schritt dazu ist die nationale Strategie gegen Antisemitismus. Denn erst wenn Jüdinnen und Jude… https://t.co/hjLJLd7ML8","WKogler",2021-09-02 10:49:03,20,3
"1433381447902060545","Besorgniserregender Bericht: im ersten Halbjahr haben sich die gemeldeten antisemitischen Vorfälle mehr als verdopp… https://t.co/0bzuHMPk1z","WKogler",2021-09-02 10:49:02,30,2
"1433034877641887745","(2/2)  Damit hält das #ParalympicTeamAustria 4 Tage vor Ende der #Paralympics bei neun Medaillen – gleich viel wie… https://t.co/9K1rby3ppJ","WKogler",2021-09-01 11:51:53,17,3
"1433034875175587842","Österreichs Handbiker radeln bei den #Paralympics in Tokio weiter in Hochform. Thomas Frühwirth eroberte im Straßen… https://t.co/a0G1BiLw5N","WKogler",2021-09-01 11:51:53,38,2
"1432731322494111755","Congratulations to the new Green ministers @patrickharvie and @lornaslater! Indeed a ground-breaking coalition betw… https://t.co/TcjlxD3tjA","WKogler",2021-08-31 15:45:40,39,5
"1432622115950415872","Medaillen-Hattrick für Österreichs Handbiker bei den Paralympics in Tokio! Walter Ablinger, Thomas Frühwirth und Al… https://t.co/AUm8X7MeGt","WKogler",2021-08-31 08:31:43,85,8
"1432326732103790597","Nochmals Silber! Dressurreiter Pepo Puch eroberte bei den #Paralympics in Tokio auf Sailor’s Blue auch im Freestyle… https://t.co/1RZhqzgjzw","WKogler",2021-08-30 12:57:58,62,0
"1431949762069204997","Zweite Medaille für das ÖPC-Team bei den Paralympics in Tokio. Ich gratuliere Florian Brungraber zu seiner großarti… https://t.co/0E4xUGuDdy","WKogler",2021-08-29 12:00:02,86,6
"1430837920420741120","Gratulation an Pepo Puch zur ersten Silbermedaille für das österreichische Paralympics-Team in Tokio! Für den Graze… https://t.co/u7jpQeREsC","WKogler",2021-08-26 10:21:58,63,8
"1430568598532247556","(4/4) die dieser Rolle Österreichs in Europa gerecht wird und Österreich nicht noch weiter in der europäischen Gemeinschaft isoliert. (wk)","WKogler",2021-08-25 16:31:47,84,5
"1430568596909043718","(3/4) und unserer Rolle als verlässlicher Partner in Europa. Es ist wichtig, dass der Innen- und der Außenminister… https://t.co/FQEiU5sDQq","WKogler",2021-08-25 16:31:46,83,4
"1430568594849550339","(2/4) Jetzt aus offenbar taktischen Gründen einen anderen Weg einzuschlagen, lässt angesichts der dramatischen Bedr… https://t.co/NBus0Z0DUK","WKogler",2021-08-25 16:31:46,74,6
"1430568592077168642","Österreich war, gerade auch aus seiner historischen Erfahrung, immer ein verlässlicher Partner in Europa und der in… https://t.co/aNVrPCip1e","WKogler",2021-08-25 16:31:45,206,32
"1430059409154224176","Heute startet für 24 Athlet:innen in Tokio das Abenteuer #Paralympics. Ich wünsche erfolgreiche, spannende und verl… https://t.co/iFw1C3lHcI","WKogler",2021-08-24 06:48:27,50,4
"1429097461902106629","Rest in Peace, Rudi Edlinger. Ich werde den ehemaligen Finanzminister als bodenständigen Vollblutpolitiker in Erinn… https://t.co/B698Bs5t8i","WKogler",2021-08-21 15:06:00,104,3
"1428404935524339713","Am 26. Oktober kommt das #Klimaticket! https://t.co/xVTQxuqUgn","WKogler",2021-08-19 17:14:09,99,13
"1426939520948260866","(2/2) CO2 bekommt einen Preis, kleine und mittlere Einkommen werden entlastet. Was das genau bedeutet, erfahrt ihr… https://t.co/R7yKTGdvrc","WKogler",2021-08-15 16:11:07,33,7
"1426939516963770370","Video: Wer sich klimafreundlich verhält, darf nicht der Dumme sein! Die extremen Wetterereignisse der vergangenen W… https://t.co/h8o8cERiis","WKogler",2021-08-15 16:11:06,71,13
"1426819824206979072","Klimaschutz bedeutet auch Kostenwahrheit, denn wer sich klimafreundlich verhält, darf nicht der Dumme sein. 2022 st… https://t.co/LSbY4nDrOB","WKogler",2021-08-15 08:15:29,117,12
"1425178465121316868","(2/2) Ob Medaillengewinner:in oder nicht, wir sind sehr stolz auf Sie. (wk) #Tokyo2020 #OlympischeSpiele","WKogler",2021-08-10 19:33:19,23,1
"1425178462021722113","Willkommen zurück an alle österreichischen Olympia-Teilnehmer:innen. In den vergangenen Wochen gab es viel Grund zu… https://t.co/HLCunZj1bN","WKogler",2021-08-10 19:33:18,58,4
"1424693751155499012","(3/3) In den vergangenen 1,5 Jahren haben wir schon die ersten Weichen für eine Klimarevolution in Österreich geleg… https://t.co/MEpzGxXqsU","WKogler",2021-08-09 11:27:14,30,2
"1424693747745439751","(2/3) Hören wir auf die Wissenschaft und setzen jetzt rasche, ambitionierte Klimaschutzmaßnahmen auf allen Ebenen u… https://t.co/ng5aie4sPL","WKogler",2021-08-09 11:27:13,32,2
"1424693743584792576","Der Bericht des @IPCC_CH zeigt einmal mehr, wie sehr die vom Menschen verursachte Klimaveränderung zur Bedrohung ge… https://t.co/RcmvQyxPLp","WKogler",2021-08-09 11:27:12,47,5
"1424379272207249408","Tief betroffen von der Nachricht des plötzlichen Ablebens von Günther Kräuter. Hoch geschätzter Gesprächspartner üb… https://t.co/PLAOZyPnfx","WKogler",2021-08-08 14:37:36,52,4
"1424347689714700293","(2/2) Ich danke und gratuliere allen, die diese Höchstleistungen möglich gemacht haben. (wk) #Tokyo2020 #OlympischeSpiele","WKogler",2021-08-08 12:32:06,21,2
"1424347686883450884","Das olympische Feuer ist erloschen, die Spiele der 32. Olympiade sind nun Geschichte. Österreichs Athletinnen und A… https://t.co/VZKhsY7nUU","WKogler",2021-08-08 12:32:06,49,5
"1423645741721997318","Das war knapp für Jessica Pilz! Auch wenn es für sie im heutigen #Kletter-Finale haarscharf zu keiner Medaille gere… https://t.co/Cw4vKJFuFO","WKogler",2021-08-06 14:02:49,76,5
"1423536307750506498","(2/2) Mein Respekt und meine Anerkennung für die Friedensnobelpreisträgerin ICAN @nuclearban und anderen Friedensin… https://t.co/0hXyV40lBF","WKogler",2021-08-06 06:47:58,35,5
"1423536305619746817","Vor 76 Jahren wurde mit einer Atombombe #Hiroshima zerstört. In wenigen Sekunden starben zehntausende Menschen. Ato… https://t.co/yViJ8Kr3rO","WKogler",2021-08-06 06:47:57,66,13
"1410638941062115328","Der heutige #AustrianWorldSummit dient vor allem dem Austausch und Dialog zwischen Politik, Wirtschaft und Zivilges… https://t.co/tKxyi2CcTs","WKogler",2021-07-01 16:38:26,44,1
"1409808609853181954","Diese Woche haben die Lehrlinge in unserem Ministerium ihr Zeugnis erhalten. Als kleines Dankeschön für die großart… https://t.co/uwhFE0KFMK","WKogler",2021-06-29 09:39:00,96,8
"1409522383426359296","Heute hab ich mir meine zweite Corona-Impfung geholt. Macht auch ihr das: denn erst mit der zweiten Impfung ist der… https://t.co/KfLfFLMsGV","WKogler",2021-06-28 14:41:38,87,12
"1409488414119022596","Heute hab ich in einer Impfstraße in Wien meine zweite Corona-Impfung erhalten. Danke an die Mitarbeiter*innen von… https://t.co/G4TuUWaH0Y","WKogler",2021-06-28 12:26:39,99,2
