"id","text","screenName","created","favoriteCount","retweetCount"
"1408904891402182659","(2/2) Schade, dass es am Ende nicht ganz gereicht hat. Trotzdem: großer Respekt für eine großartige Leistung. Für m… https://t.co/vC14gUGSqy","WKogler",2021-06-26 21:47:56,141,4
"1408904888663281671","Was für ein dramatisches Duell! Das @oefb1904 Nationalteam hat sich mit unglaublichem Einsatz gegen einen der große… https://t.co/1q8R99AX62","WKogler",2021-06-26 21:47:56,271,10
"1408740696224378882","(2/2) und seiner humorvollen Art aus so manchem Tief geholt. Ihm folgt mit @EvaHammerer und @DaZaLauSa ein gewinnen… https://t.co/TdnF6um4bW","WKogler",2021-06-26 10:55:29,40,2
"1408740694211039233","Heute hat @johannes_rauch seine Funktion bei den Vorarlberger Grünen nach 24 Jahren abgegeben. Auch für mich persön… https://t.co/egy8A6GOF1","WKogler",2021-06-26 10:55:29,73,7
"1408460448459075591","Das Projekt ""Raus aus Gas im Neubau"" ist ein Beispiel dafür, wie wir aus dem fossilen Zeitalter rein ins Solarzeita… https://t.co/aNPUV1ydmA","WKogler",2021-06-25 16:21:53,49,3
"1408417376555737095","Beim heutigen Arbeitsgespräch habe ich mich mit Bundespräsident Alexander @vanderbellen, OeNB-Gouverneur Robert Hol… https://t.co/R2SXTgMLiW","WKogler",2021-06-25 13:30:44,52,5
"1408367214651068417","Die Abteilung Energieplanung der @Stadt_Wien hat den österreichischen Verwaltungspreis in der Kategorie Nachhaltigk… https://t.co/FkNQu0ialU","WKogler",2021-06-25 10:11:24,39,5
"1408060728615919619","Danke @pepssch. Ein super Gesprächspartner – und auch Streitpartner im besten Sinne des Wortes. Ich schätze deine u… https://t.co/ny9r4o5TIP","WKogler",2021-06-24 13:53:32,113,3
"1407723942169743362","Grüße aus Wien nach München. #loveislove #GERHUN https://t.co/HMFSNIUn7b","WKogler",2021-06-23 15:35:16,78,5
"1407683568701149184","Ich halte es für wichtig und richtig, dass auch Österreich die gemeinsame Erklärung gegen das homophobe Gesetz in U… https://t.co/o0tnodh29E","WKogler",2021-06-23 12:54:50,588,34
"1407043163697602564","Wembley, wir kommen! Gratulation zu dieser taktischen Meisterleistung, zu dieser Willensstärke - und zum ersten K.o… https://t.co/t06aBHgqB7","WKogler",2021-06-21 18:30:06,193,13
"1406957905618817028","Danke für das konstruktive Gespräch, Judit Marte-Huainigg und @JohannesKopf! Gemeinsam mit @lgewessler haben wir üb… https://t.co/e9rUP2aH06","WKogler",2021-06-21 12:51:19,44,5
"1406288520042496003","Das war die Regenbogenparade 2021. <U+0001F3F3><U+FE0F><U+200D><U+0001F308> <U+0001F3F3><U+FE0F><U+200D><U+26A7><U+FE0F> Liebe ist Liebe! #staysafe #stayproud #happypride https://t.co/3EGnYhgMah","WKogler",2021-06-19 16:31:25,324,14
"1406273176829579270","Der langjährige Kohlekraftwerksblock Hemweg in #Amsterdam wird rückgebaut, erneuerbare Energie und Speicher ersetze… https://t.co/4Nrq22en8b","WKogler",2021-06-19 15:30:27,48,9
"1405901778944774151","In #Amsterdam hab ich nicht nur Fußballfans getroffen, sondern auch Mitglieder der Amsterdamer Stadtregierung. Durc… https://t.co/K7WataOjDn","WKogler",2021-06-18 14:54:39,74,13
"1405776469985398789","Auch, wenn ich mir fürs gestrige Spiel ein anderes Ergebnis gewünscht hätte: es war eine Freude, das EM-Spiel live… https://t.co/nTPP6UJUSD","WKogler",2021-06-18 06:36:43,99,4
"1405554952693506058","(2/2) Österreichs Städte können von Amsterdam viel lernen: Hier findet viel technologische und soziale Innovation s… https://t.co/5hdP80xMZX","WKogler",2021-06-17 15:56:29,28,1
"1405554949568741380","Goede dag, Marieke! Im Amsterdamer Rathaus habe ich heute u.a. Vizebürgermeisterin Marieke van Doorninck von… https://t.co/HKMaeTLDN7","WKogler",2021-06-17 15:56:28,54,2
"1405457937229922308","Heute früh bin ich mit dem #Nightjet in #Amsterdam angekommen, um unser Nationalteam @oefb1904 <U+0001F1E6><U+0001F1F9> beim EM-Spiel geg… https://t.co/nvuNIUCpA8","WKogler",2021-06-17 09:30:59,407,33
"1405189011640029186","Im Bundessport- und Freizeitzentrum in der Südstadt habe ich drei Leichtathletik-Olympiahoffnungen beim Training be… https://t.co/niWuRSW4QJ","WKogler",2021-06-16 15:42:22,25,1
"1404758641115340808","(2/2) Damit folgen wir auch den Ratschlägen renommierter Wirtschaftsforscher*innen und legen einen Schwerpunkt weit… https://t.co/1LSfEnB23R","WKogler",2021-06-15 11:12:13,8,2
"1404758639135662084","Wir werden weiter jene Unternehmen unterstützen, die es krisenbedingt immer noch besonders schwer haben und fahren… https://t.co/ud82QvLdoi","WKogler",2021-06-15 11:12:13,29,4
"1404691948523429890","Gemeinsam mit Landeshauptfrau Johanna Mikl-Leitner hab ich mir die Ausstellung „Das Jahrhundert des Sports“ angesch… https://t.co/bsJohXho5o","WKogler",2021-06-15 06:47:13,31,4
